{
    "fileVersion": "1.1.0",
    "standardsVersion": "1.20.0",
    "title": "Create data holder",
    "description": "Test data generated by the CDR Test Data CLI",
    "holders": [
      {
        "holderId": "739181657",
        "holder": {
          "unauthenticated": {},
          "authenticated": {
            "customers": [
              {
                "customerId": "585059421",
                "customer": {
                  "customerUType": "organisation",
                  "organisation": {
                    "physicalAddresses": [
                      {
                        "purpose": "REGISTERED",
                        "addressUType": "paf",
                        "paf": {
                          "localityName": "Garden - Anderson",
                          "postcode": "3145",
                          "state": "Australian Capital Territory",
                          "postalDeliveryType": "LOCKED_BAG",
                          "postalDeliveryNumber": 26523047,
                          "dpid": "28095245",
                          "thoroughfareNumber1": 3456,
                          "thoroughfareNumber1Suffix": "HWY",
                          "thoroughfareNumber2": 3466,
                          "thoroughfareNumber2Suffix": "HWY",
                          "flatUnitType": "UNIT",
                          "floorLevelNumber": "48",
                          "streetName": "Jenkins Drive",
                          "streetType": "ROAD",
                          "lotNumber": "LOT 2",
                          "buildingName1": "Treasury Building"
                        }
                      },
                      {
                        "purpose": "PHYSICAL",
                        "addressUType": "simple",
                        "simple": {
                          "mailingName": "Marks - Reynolds",
                          "localityName": "Kreigershire",
                          "addressLine1": "Joseph Mews",
                          "postcode": "6761",
                          "city": "Tallahassee",
                          "state": "Australian Capital Territory",
                          "country": "AUS",
                          "addressLine3": "886"
                        }
                      },
                      {
                        "purpose": "OTHER",
                        "addressUType": "paf",
                        "paf": {
                          "localityName": "Jones - Collier",
                          "postcode": "2844",
                          "state": "Australian Capital Territory",
                          "postalDeliveryType": "LOCKED_BAG",
                          "postalDeliveryNumber": 27642234,
                          "flatUnitType": "UNIT",
                          "flatUnitNumber": "42",
                          "floorLevelNumber": "72",
                          "streetName": "Hudson Trail",
                          "streetType": "ROAD",
                          "streetSuffix": "E",
                          "lotNumber": "LOT 2",
                          "buildingName1": "Reception area"
                        }
                      }
                    ],
                    "agentRole": "Unspecified",
                    "businessName": "Goldner - Muller",
                    "organisationType": "OTHER",
                    "agentLastName": "Lynch",
                    "registeredCountry": "USA",
                    "isACNCRegistered": true
                  }
                }
              },
              {
                "customerId": "577606391",
                "customer": {
                  "customerUType": "person",
                  "person": {
                    "firstName": "Emily",
                    "lastName": "Graham",
                    "middleNames": [
                      "Reese"
                    ],
                    "phoneNumbers": [
                      {
                        "isPreferred": true,
                        "purpose": "INTERNATIONAL",
                        "countryCode": "+61",
                        "areaCode": "02",
                        "number": "02-4036-7003",
                        "extension": "x34",
                        "fullNumber": "+61 02-1144 7390"
                      },
                      {
                        "isPreferred": true,
                        "purpose": "HOME",
                        "countryCode": "+61",
                        "areaCode": "02",
                        "number": "02-5544-7993",
                        "extension": "x34",
                        "fullNumber": "+61 02-4907 7184"
                      },
                      {
                        "isPreferred": true,
                        "purpose": "MOBILE",
                        "countryCode": "+61",
                        "areaCode": "02",
                        "number": "02-8190-9103",
                        "extension": "x34",
                        "fullNumber": "+61 02-2022 1863"
                      }
                    ],
                    "emailAddresses": [
                      {
                        "isPreferred": true,
                        "purpose": "HOME",
                        "address": "Dylan_Hane@gmail.com"
                      },
                      {
                        "isPreferred": false,
                        "purpose": "HOME",
                        "address": "Jack_Moore94@gmail.com"
                      }
                    ],
                    "physicalAddresses": [
                      {
                        "purpose": "WORK",
                        "addressUType": "paf",
                        "paf": {
                          "localityName": "Rose Harber",
                          "postcode": "3719",
                          "state": "Australian Capital Territory",
                          "dpid": "27540006",
                          "floorLevelNumber": "77",
                          "streetName": "Matthew Square",
                          "streetType": "ROAD",
                          "streetSuffix": "E"
                        }
                      },
                      {
                        "purpose": "WORK",
                        "addressUType": "simple",
                        "simple": {
                          "mailingName": "Mr. Priscilla James",
                          "localityName": "South Aidenborough",
                          "addressLine1": "Dare Island",
                          "postcode": "6468",
                          "city": "Hempstead",
                          "state": "New South Wales",
                          "country": "AUS"
                        }
                      }
                    ],
                    "occupationCode": "113268",
                    "occupationCodeVersion": "ANZSCO_1220.0_2013_V1.3",
                    "lastUpdateTime": "2022-11-16T14:11:56.221Z",
                    "suffix": "Sr.",
                    "prefix": "Mr."
                  }
                }
              }
            ]
          }
        }
      }
    ]
  }